[
  {
    "input_date": "2026-02-08",
    "summary": "이번 주 다이제스트는 '월드모델·실시간 콘텐츠·거대 투자'라는 세 축이 두드러집니다. 구글의 Genie3와 크롬 내 Gemini 통합처럼 인터랙티브 3D 세계와 브라우저 기반 AI 비서가 주목을 받았고, Odyssey·Lucy 등 월드모델과 실시간 영상 기술도 잇따라 발표되었습니다. 동시에 엔비디아의 기상 모델이나 어도비의 문서 AI, 휴머노이드·로봇 제어 업데이트까지 산업 전반에서 AI 실용화와 제품화가 가속화되는 모습이 관찰됩니다.",
    "highlights": [
      {
        "title": "Google의 Genie3: 텍스트·이미지로 실시간 3D 세계 생성·탐험",
        "summary": "Genie3는 미국의 Google AI Ultra 구독자(18세 이상)를 대상으로 공개된 실시간 월드모델로, 텍스트와 이미지 입력으로 3D 세계를 생성하고 사용자가 직접 탐험할 수 있는 기능을 제공한다. Nano Banana를 통한 스케치·디자인 지원, Gemini의 지식·추론 보조, World Sketching/Exploration/Remixing 등으로 세계를 만들고 공유·리믹스하는 흐름을 강조하며, 물리 이해와 지속적 기억(예: 충돌·발자국 추적) 기능이 보고되고 있다.",
        "why_it_matters": "실시간으로 생성되는 몰입형 세계와 사용자의 상호작용·기억을 결합하면 새로운 엔터테인먼트·소셜·경제 생태계가 형성될 가능성이 크다. 이미 관련 발표 직후 주요 게임·엔진 주가가 하락한 점은 기존 게임·플랫폼 사업자들에게 구조적 충격을 줄 수 있음을 시사한다."
      },
      {
        "title": "빅테크의 대규모 AI 투자 확대",
        "summary": "대형 기술기업들이 2026년 AI 관련 투자 예산을 크게 늘리고 있다는 요약이 제시됐다. 제시된 투자 규모로는 아마존 2,000억달러, 구글 1,800억달러, 메타 1,250억달러, 마이크로소프트 1,175억달러, 테슬라 200억달러, 애플 130억달러 등으로 전년 대비 큰 폭의 증액이 포함되어 있다.",
        "why_it_matters": "자본의 대규모 유입은 인프라·연구·제품화 속도를 가속하고 경쟁을 심화시킨다. 이는 AI 인재 유치, 클라우드·하드웨어 투자 확대, 신제품 출시에 따른 시장 재편 가능성을 높인다."
      },
      {
        "title": "크롬에 통합된 Gemini: 브라우저가 AI 작업 플랫폼으로",
        "summary": "구글이 Gemini를 크롬에 통합해 브라우저에서 직접 AI 비서 기능을 제공하기 시작했다. Auto Browse(사용자 지시 없이 다단계 웹 작업 수행), 사이드 패널 유지·작업, 구글 생태계 연동 및 크롬 기반 자동 쇼핑 기능 등으로 구성되며 현재는 미국의 AI Pro·Ultra 이용자 일부에 제공되고 있다.",
        "why_it_matters": "브라우저에 AI 비서가 통합되면 별도 AI 브라우저나 확장 앱 사용 필요성이 줄어들고, 웹 작업 자동화·전자상거래 경험이 직접적으로 바뀔 수 있다. 이는 AI 기능의 대중화와 동시에 구글 생태계의 경쟁력 강화를 의미한다."
      }
    ],
    "items": [
      {
        "title": "Odyssey-2 Pro 월드모델 공개",
        "summary": "Odyssey-2 Pro는 4D(3차원+시간) 기반의 월드모델로, 시뮬레이션을 통해 세계의 진화와 인과관계를 예측하며 720p·22FPS 스트리밍과 월드모델 API를 제공한다."
      },
      {
        "title": "엔비디아 Earth-2 기상 예측 모델",
        "summary": "Earth-2는 디지털 트윈 기반 기상 시뮬레이션으로 슈퍼컴퓨터 대비 빠른 계산을 목표로 하며, Nowcasting(6시간 이내 국지성 예측)과 최대 15일 예측 기능을 제공한다."
      },
      {
        "title": "어도비, Acrobat에 AI 기능 추가",
        "summary": "어도비는 PDF를 오디오 팟캐스트·프레젠테이션·프롬프트 기반 편집 등 AI로 확장해 문서 플랫폼 기능을 강화할 계획이다."
      },
      {
        "title": "Figure Helix 02 업데이트",
        "summary": "Helix 02는 전신의 협응 동작(Long-Horizon loco-manipulation), 3계층 통합 아키텍처(System0 추가)로 고주파 제어를 도입하고, 손끝 촉각 센서로 정밀 조작 능력을 개선했다."
      },
      {
        "title": "Decart Lucy 2.0: 실시간 영상 생성·편집",
        "summary": "Lucy 2.0은 1080p·30FPS로 Near-zero latency 실시간 영상 생성과 장면 리스타일링·캐릭터 교체를 지원해 실시간 콘텐츠 제작을 목표로 한다."
      },
      {
        "title": "Fourier, 뇌파(BCI) 활용 로봇 학습 공개",
        "summary": "중국의 Fourier는 GR-3 모델에 BCI(Brain-Computer Interface)를 적용해 인간의 뇌파를 활용한 로봇 학습을 시연했다는 소식이 전해졌다."
      },
      {
        "title": "텐센트 'The Script is All You Need' 프레임워크",
        "summary": "텐센트는 스크립트만으로 시네마틱 영상을 생성하는 에이전트 프레임워크를 발표했으며, Scripter·Director·Critic 에이전트로 제작 파이프라인을 구성한다."
      },
      {
        "title": "Kling 3.0 얼리 액세스 공개",
        "summary": "Kling 3.0은 일부 유저 대상 얼리 액세스 중이며 멀티샷 연속성, 향상된 음성 구현과 감정 표현 능력 등 주요 품질 개선을 포함한다."
      },
      {
        "title": "Perplexity 'Model Council' 출시",
        "summary": "Perplexity는 한 번의 질문에 여러 모델의 답변을 받을 수 있는 'Model Council' 기능을 발표했으며 현재는 유료 구독(Max Plan) 사용자에게 제공된다."
      },
      {
        "title": "Nano Banana Flash 2 출시 임박 보도",
        "summary": "구글의 Nano Banana 시리즈에 기반한 Flash 2가 곧 출시된다는 소문이 있으며, Flash 2는 빠른 속도와 Pro급 품질을 표방한다."
      },
      {
        "title": "Figma, Vectorize 기능 공개",
        "summary": "Figma가 Vectorize 기능을 도입해 저해상도 이미지를 벡터로 변환하는 지원을 추가했으며 배경 삭제·객체 지우기 등 편집 기능과 결합해 디자인 작업 효율을 높인다."
      },
      {
        "title": "Eleven Labs, 'The Eleven Album' 발표",
        "summary": "Eleven Labs는 인간 아티스트의 목소리를 유지하면서 악기·연주 파트를 AI로 생성한 'The Eleven Album'을 공개했으며, 참여 아티스트들과 수익 배분 방식이 안내됐다."
      },
      {
        "title": "MiniMax Music 2.5 업데이트",
        "summary": "MiniMax는 2.5 버전에서 보컬 감정 표현과 자연스러운 믹싱 기능을 강화해 음원 생성 품질을 개선했다."
      }
    ],
    "ending": "요약하면 이 시점의 AI 흐름은 '실시간성·상호작용·대규모 자본'의 결합으로 요약됩니다. 월드모델·실시간 미디어·로봇 제어·생성형 미디어가 동시에 발전하면서 단순 연구 단계를 넘어 제품과 생태계 전환이 가속화되고 있습니다."
  }
]